1<?xml version="1.0" encoding="windows-1251"?>
        <!ELEMENT dataSheet (data)*>
        <!ELEMENT data (x,y)*>
        <!ATTLIST data date CDATA #IMPLIED>
        <!ELEMENT x (#PCDATA)>
        <!ELEMENT y (#PCDATA)>